{
    "$schema" : "http://json-schema.org/draft-03/schema",
    "title" : "glTF",
    "type" : "object",
    "description" : "Top-level glTF property.",
    "properties" : {
        "asset" : {
            "$ref" : "asset.schema.json"
        },
        "accessors" : {
            "properties" : {
            },
            "additionalProperties" : {
                "$ref" : "accessor.schema.json"
            }
        },
        "animations" : {
            "properties" : {
            },
            "additionalProperties" : {
                "$ref" : "animation.schema.json"
            }
        },
        "buffers" : {
            "properties" : {
            },
            "additionalProperties" : {
                "$ref" : "buffer.schema.json"
            }
        },
        "bufferViews" : {
            "properties" : {
            },
            "additionalProperties" : {
                "$ref" : "bufferView.schema.json"
            }
        },
        "cameras" : {
            "properties" : {
            },
            "additionalProperties" : {
                "$ref" : "camera.schema.json"
            }
        },
        "extensions" : {
            "type" : "array",
            "description" : "Names of extensions used by this model.  WebGL: see getSupportedExtensions() and getExtension().",
            "items" : {
                "type" : "string"
            },
            "uniqueItems" : true
        },
        "images" : {
            "properties" : {
            },
            "additionalProperties" : {
                "$ref" : "image.schema.json"
            }
        },
        "lights" : {
            "properties" : {
            },
            "additionalProperties" : {
                "$ref" : "light.schema.json"
            }
        },
        "materials" : {
            "properties" : {
            },
            "additionalProperties" : {
                "$ref" : "material.schema.json"
            }
        },
        "meshes" : {
            "properties" : {
            },
            "additionalProperties" : {
                "$ref" : "mesh.schema.json"
            }
        },
        "nodes" : {
            "properties" : {
            },
            "additionalProperties" : {
                "$ref" : "node.schema.json"
            }
        },
        "programs" : {
            "properties" : {
            },
            "additionalProperties" : {
                "$ref" : "program.schema.json"
            }
        },
        "samplers" : {
            "properties" : {
            },
            "additionalProperties" : {
                "$ref" : "sampler.schema.json"
            }
        },
        "scene" : {
            "type" : "string",
            "description" : "The id (JSON property name) of the default scene."
        },
        "scenes" : {
            "properties" : {
            },
            "additionalProperties" : {
                "$ref" : "scene.schema.json"
            }
        },
        "shaders" : {
            "properties" : {
            },
            "additionalProperties" : {
                "$ref" : "shader.schema.json"
            }
        },
        "skins" : {
            "properties" : {
            },
            "additionalProperties" : {
                "$ref" : "skin.schema.json"
            }
        },
        "techniques" : {
            "properties" : {
            },
            "additionalProperties" : {
                "$ref" : "technique.schema.json"
            }
        },
        "profile" : {
            "type" : "string",
            "description" : "Specifies the target rendering API and version, e.g., WebGL 1.0.2.",
            "default" : "WebGL 1.0.2"
        },        
        "version" : {
            "type" : "string",
            "description" : "The glTF version.",
            "default" : "1.0"
        },
        "textures" : {
            "properties" : {
            },
            "additionalProperties" : {
                "$ref" : "texture.schema.json"
            }
        },
        "extras" : {
            "type" : "any",
            "description" : "Optional application-specific data."
        }
    },
    "additionalProperties" : false
}
